<!--
################################################################################
#
# Copyright 2010 Carlos Ramisch
#
# mwetoolkit-candidates.dtd is part of mwetoolkit
#
# mwetoolkit is free software: you can redistribute it and/or modify
# it under the terms of the GNU General Public License as published by
# the Free Software Foundation, either version 3 of the License, or
# (at your option) any later version.
#
# mwetoolkit is distributed in the hope that it will be useful,
# but WITHOUT ANY WARRANTY; without even the implied warranty of
# MERCHANTABILITY or FITNESS FOR A PARTICULAR PURPOSE.  See the
# GNU General Public License for more details.
#
# You should have received a copy of the GNU General Public License
# along with mwetoolkit.  If not, see <http://www.gnu.org/licenses/>.
#
################################################################################
-->
<!ELEMENT candidates (meta,cand*)>
<!ELEMENT meta (corpussize*,metafeat*,metatpclass*)>
<!ELEMENT corpussize EMPTY>
<!ATTLIST corpussize
    name CDATA #REQUIRED
    value CDATA #REQUIRED
>
<!ELEMENT metafeat EMPTY>
<!-- type of metafeat should be integer, real, string or an 
enumeration of values between curly brackets, in the same style as
WEKA's arff file format -->
<!ATTLIST metafeat
    name CDATA #REQUIRED
    type CDATA #REQUIRED
>
<!ELEMENT metatpclass EMPTY>
<!-- type of metatpclass should be an enumeration of values between 
curly brackets, in the same style as WEKA's arff file format -->
<!ATTLIST metatpclass
    name CDATA #REQUIRED
    type CDATA #REQUIRED
>
<!ELEMENT cand (ngram,occurs?,features?,tpclass*)>
<!ATTLIST cand
    candid CDATA #IMPLIED
>
<!ELEMENT ngram (w+,freq*)>
<!ELEMENT w (freq)*>
<!ATTLIST w
    surface CDATA #IMPLIED
    lemma CDATA #IMPLIED
    pos CDATA #IMPLIED
> 
<!ELEMENT freq EMPTY>
<!ATTLIST freq
    name CDATA #REQUIRED
    value CDATA #REQUIRED
>
<!ELEMENT occurs (ngram*)>
<!ELEMENT features (feat*)>
<!ELEMENT feat EMPTY>
<!ATTLIST feat
    name CDATA #REQUIRED
    value CDATA #REQUIRED
> 

<!ELEMENT tpclass EMPTY>
<!ATTLIST tpclass
    name CDATA #REQUIRED
    value CDATA #REQUIRED
>
